{
  "schema_version": "1.0",
  "generated_at": "2026-06-11T22:30:00.000Z",
  "account_id": "acct_bridgepoint_gtm",
  "account_name": "Bridgepoint GTM",
  "website": "https://bridgepoint-gtm.example",
  "segment": "solo_consultant",
  "source": "demo fixture",
  "summary": "GTM consultant with curated target lists, wants explicit fit scoring, missing-info flags, and low-pressure first-touch drafts.",
  "review_status": "needs_review",
  "review_note": "",
  "fit_score": 72,
  "score_breakdown": {
    "icp_match": 30,
    "pain_signal": 0,
    "ability_to_pay": 15,
    "reachable_context": 15,
    "timing_signal": 2,
    "strategic_relevance": 10
  },
  "fit_rationale": "This account appears aligned with the MVP because the target data points to relationship-heavy revenue work, scattered context, or follow-up discipline needs.",
  "confidence": "high",
  "evidence": [
    {
      "id": "ev_bridgepoint_gtm_note_1",
      "source_type": "operator_note",
      "source_url": "inputs/targets.csv",
      "claim": "GTM consultant with curated target lists.",
      "confidence": "medium",
      "captured_at": "2026-06-11T22:30:00.000Z"
    },
    {
      "id": "ev_bridgepoint_gtm_note_2",
      "source_type": "operator_note",
      "source_url": "inputs/targets.csv",
      "claim": "wants explicit fit scoring.",
      "confidence": "medium",
      "captured_at": "2026-06-11T22:30:00.000Z"
    },
    {
      "id": "ev_bridgepoint_gtm_website",
      "source_type": "website",
      "source_url": "https://bridgepoint-gtm.example",
      "claim": "Website listed for account: https://bridgepoint-gtm.example",
      "confidence": "medium",
      "captured_at": "2026-06-11T22:30:00.000Z"
    },
    {
      "id": "ev_bridgepoint_gtm_segment",
      "source_type": "target_csv",
      "source_url": "inputs/targets.csv",
      "claim": "Segment from target list: solo_consultant",
      "confidence": "high",
      "captured_at": "2026-06-11T22:30:00.000Z"
    },
    {
      "id": "ev_bridgepoint_gtm_source",
      "source_type": "target_csv",
      "source_url": "inputs/targets.csv",
      "claim": "Imported from source: demo fixture",
      "confidence": "high",
      "captured_at": "2026-06-11T22:30:00.000Z"
    }
  ],
  "contacts": [],
  "missing_information": [
    "Named buyer or decision-maker",
    "Recent public proof beyond operator notes",
    "Follow-up trigger or current relationship context"
  ],
  "disqualifiers": [],
  "suggested_angle": "Lead with evidence-backed lead briefs and review-gated drafts for solo consultant operators.",
  "recommended_next_action": "Review the lead brief, confirm the buyer/contact, then edit or approve the draft manually.",
  "approval_gate": "Operator review only. Agentic Hub does not send messages, submit forms, mutate CRM records, or use credentials in the MVP."
}
