{
  "schema_version": "1.0",
  "generated_at": "2026-06-11T22:30:00.000Z",
  "account_id": "acct_07",
  "account_name": "Account 07",
  "website": "https://account-07.example",
  "segment": "boutique_agency",
  "source": "demo fixture",
  "summary": "Six-person product studio selling discovery sprints, tracks prospects in a sheet, inconsistent post-proposal follow-ups, no segment conversion report.",
  "review_status": "needs_review",
  "review_note": "",
  "fit_score": 82,
  "score_breakdown": {
    "icp_match": 28,
    "pain_signal": 12,
    "ability_to_pay": 15,
    "reachable_context": 15,
    "timing_signal": 2,
    "strategic_relevance": 10
  },
  "fit_rationale": "This account appears aligned with the MVP because the target data points to relationship-heavy revenue work, scattered context, or follow-up discipline needs.",
  "confidence": "high",
  "evidence": [
    {
      "id": "ev_acct_07_research_9",
      "source_type": "approved_public_source",
      "source_url": "https://account-07.example/process",
      "claim": "Public process page describes proposal follow-up as part of productized discovery.",
      "confidence": "high",
      "captured_at": "2026-06-11T22:30:00.000Z"
    },
    {
      "id": "ev_account_07_note_1",
      "source_type": "operator_note",
      "source_url": "inputs/targets.csv",
      "claim": "Six-person product studio selling discovery sprints.",
      "confidence": "medium",
      "captured_at": "2026-06-11T22:30:00.000Z"
    },
    {
      "id": "ev_account_07_note_2",
      "source_type": "operator_note",
      "source_url": "inputs/targets.csv",
      "claim": "tracks prospects in a sheet.",
      "confidence": "medium",
      "captured_at": "2026-06-11T22:30:00.000Z"
    },
    {
      "id": "ev_account_07_website",
      "source_type": "website",
      "source_url": "https://account-07.example",
      "claim": "Website listed for account: https://account-07.example",
      "confidence": "medium",
      "captured_at": "2026-06-11T22:30:00.000Z"
    },
    {
      "id": "ev_account_07_segment",
      "source_type": "target_csv",
      "source_url": "inputs/targets.csv",
      "claim": "Segment from target list: boutique_agency",
      "confidence": "high",
      "captured_at": "2026-06-11T22:30:00.000Z"
    },
    {
      "id": "ev_account_07_source",
      "source_type": "target_csv",
      "source_url": "inputs/targets.csv",
      "claim": "Imported from source: demo fixture",
      "confidence": "high",
      "captured_at": "2026-06-11T22:30:00.000Z"
    }
  ],
  "contacts": [
    {
      "id": "contact_07",
      "name": "Contact 07",
      "role": "Studio Lead",
      "context": "Operator-provided buyer for proposal follow-up and segment conversion reporting",
      "source": "fixture contacts",
      "confidence": "medium"
    }
  ],
  "missing_information": [],
  "disqualifiers": [],
  "suggested_angle": "Lead with evidence-backed lead briefs and review-gated drafts for boutique agency operators.",
  "recommended_next_action": "Review the lead brief, confirm the buyer/contact, then edit or approve the draft manually.",
  "approval_gate": "Operator review only. Agentic Hub does not send messages, submit forms, mutate CRM records, or use credentials in the MVP."
}
