{
  "schema_version": "1.0",
  "generated_at": "2026-06-11T22:30:00.000Z",
  "account_id": "acct_summit_revops_lab",
  "account_name": "Summit RevOps Lab",
  "website": "https://summit-revops.example",
  "segment": "solo_consultant",
  "source": "demo fixture",
  "summary": "RevOps advisor with high-value CRM cleanup projects, has a target account sheet, needs better context before outreach and weekly analytics.",
  "review_status": "needs_review",
  "review_note": "",
  "fit_score": 76,
  "score_breakdown": {
    "icp_match": 30,
    "pain_signal": 4,
    "ability_to_pay": 15,
    "reachable_context": 15,
    "timing_signal": 2,
    "strategic_relevance": 10
  },
  "fit_rationale": "This account appears aligned with the MVP because the target data points to relationship-heavy revenue work, scattered context, or follow-up discipline needs.",
  "confidence": "high",
  "evidence": [
    {
      "id": "ev_summit_revops_lab_note_1",
      "source_type": "operator_note",
      "source_url": "inputs/targets.csv",
      "claim": "RevOps advisor with high-value CRM cleanup projects.",
      "confidence": "medium",
      "captured_at": "2026-06-11T22:30:00.000Z"
    },
    {
      "id": "ev_summit_revops_lab_note_2",
      "source_type": "operator_note",
      "source_url": "inputs/targets.csv",
      "claim": "has a target account sheet.",
      "confidence": "medium",
      "captured_at": "2026-06-11T22:30:00.000Z"
    },
    {
      "id": "ev_summit_revops_lab_website",
      "source_type": "website",
      "source_url": "https://summit-revops.example",
      "claim": "Website listed for account: https://summit-revops.example",
      "confidence": "medium",
      "captured_at": "2026-06-11T22:30:00.000Z"
    },
    {
      "id": "ev_summit_revops_lab_segment",
      "source_type": "target_csv",
      "source_url": "inputs/targets.csv",
      "claim": "Segment from target list: solo_consultant",
      "confidence": "high",
      "captured_at": "2026-06-11T22:30:00.000Z"
    },
    {
      "id": "ev_summit_revops_lab_source",
      "source_type": "target_csv",
      "source_url": "inputs/targets.csv",
      "claim": "Imported from source: demo fixture",
      "confidence": "high",
      "captured_at": "2026-06-11T22:30:00.000Z"
    }
  ],
  "contacts": [],
  "missing_information": [
    "Named buyer or decision-maker",
    "Recent public proof beyond operator notes",
    "Follow-up trigger or current relationship context"
  ],
  "disqualifiers": [],
  "suggested_angle": "Lead with a local pipeline sprint for solo consultant teams that connects research quality, follow-up review, and weekly analytics.",
  "recommended_next_action": "Review the lead brief, confirm the buyer/contact, then edit or approve the draft manually.",
  "approval_gate": "Operator review only. Agentic Hub does not send messages, submit forms, mutate CRM records, or use credentials in the MVP."
}
