{
  "schema_version": "1.0",
  "generated_at": "2026-06-11T22:30:00.000Z",
  "account_id": "acct_20",
  "account_name": "Account 20",
  "website": "https://account-20.example",
  "segment": "boutique_agency",
  "source": "demo fixture",
  "summary": "Digital agency serving local services, has many old discovery notes, needs stale opportunity revive drafts and pipeline source analytics.",
  "review_status": "needs_review",
  "review_note": "",
  "fit_score": 80,
  "score_breakdown": {
    "icp_match": 28,
    "pain_signal": 8,
    "ability_to_pay": 15,
    "reachable_context": 15,
    "timing_signal": 4,
    "strategic_relevance": 10
  },
  "fit_rationale": "This account appears aligned with the MVP because the target data points to relationship-heavy revenue work, scattered context, or follow-up discipline needs.",
  "confidence": "high",
  "evidence": [
    {
      "id": "ev_account_20_note_1",
      "source_type": "operator_note",
      "source_url": "inputs/targets.csv",
      "claim": "Digital agency serving local services.",
      "confidence": "medium",
      "captured_at": "2026-06-11T22:30:00.000Z"
    },
    {
      "id": "ev_account_20_note_2",
      "source_type": "operator_note",
      "source_url": "inputs/targets.csv",
      "claim": "has many old discovery notes.",
      "confidence": "medium",
      "captured_at": "2026-06-11T22:30:00.000Z"
    },
    {
      "id": "ev_account_20_website",
      "source_type": "website",
      "source_url": "https://account-20.example",
      "claim": "Website listed for account: https://account-20.example",
      "confidence": "medium",
      "captured_at": "2026-06-11T22:30:00.000Z"
    },
    {
      "id": "ev_account_20_segment",
      "source_type": "target_csv",
      "source_url": "inputs/targets.csv",
      "claim": "Segment from target list: boutique_agency",
      "confidence": "high",
      "captured_at": "2026-06-11T22:30:00.000Z"
    },
    {
      "id": "ev_account_20_source",
      "source_type": "target_csv",
      "source_url": "inputs/targets.csv",
      "claim": "Imported from source: demo fixture",
      "confidence": "high",
      "captured_at": "2026-06-11T22:30:00.000Z"
    }
  ],
  "contacts": [],
  "missing_information": [
    "Named buyer or decision-maker",
    "Recent public proof beyond operator notes",
    "Follow-up trigger or current relationship context"
  ],
  "disqualifiers": [],
  "suggested_angle": "Lead with a local pipeline sprint for boutique agency teams that connects research quality, follow-up review, and weekly analytics.",
  "recommended_next_action": "Review the lead brief, confirm the buyer/contact, then edit or approve the draft manually.",
  "approval_gate": "Operator review only. Agentic Hub does not send messages, submit forms, mutate CRM records, or use credentials in the MVP."
}
