{
  "schema_version": "1.0",
  "generated_at": "2026-06-11T22:30:00.000Z",
  "account_id": "acct_24",
  "account_name": "Account 24",
  "website": "https://account-24.example",
  "segment": "solo_consultant",
  "source": "demo fixture",
  "summary": "Two-person ops consultancy with relationship-heavy pipeline, follow-up reminders in memory, and weak evidence capture before outreach.",
  "review_status": "needs_review",
  "review_note": "",
  "fit_score": 74,
  "score_breakdown": {
    "icp_match": 30,
    "pain_signal": 4,
    "ability_to_pay": 15,
    "reachable_context": 15,
    "timing_signal": 0,
    "strategic_relevance": 10
  },
  "fit_rationale": "This account appears aligned with the MVP because the target data points to relationship-heavy revenue work, scattered context, or follow-up discipline needs.",
  "confidence": "high",
  "evidence": [
    {
      "id": "ev_account_24_note_1",
      "source_type": "operator_note",
      "source_url": "inputs/targets.csv",
      "claim": "Two-person ops consultancy with relationship-heavy pipeline.",
      "confidence": "medium",
      "captured_at": "2026-06-11T22:30:00.000Z"
    },
    {
      "id": "ev_account_24_note_2",
      "source_type": "operator_note",
      "source_url": "inputs/targets.csv",
      "claim": "follow-up reminders in memory.",
      "confidence": "medium",
      "captured_at": "2026-06-11T22:30:00.000Z"
    },
    {
      "id": "ev_account_24_website",
      "source_type": "website",
      "source_url": "https://account-24.example",
      "claim": "Website listed for account: https://account-24.example",
      "confidence": "medium",
      "captured_at": "2026-06-11T22:30:00.000Z"
    },
    {
      "id": "ev_account_24_segment",
      "source_type": "target_csv",
      "source_url": "inputs/targets.csv",
      "claim": "Segment from target list: solo_consultant",
      "confidence": "high",
      "captured_at": "2026-06-11T22:30:00.000Z"
    },
    {
      "id": "ev_account_24_source",
      "source_type": "target_csv",
      "source_url": "inputs/targets.csv",
      "claim": "Imported from source: demo fixture",
      "confidence": "high",
      "captured_at": "2026-06-11T22:30:00.000Z"
    }
  ],
  "contacts": [],
  "missing_information": [
    "Named buyer or decision-maker",
    "Recent public proof beyond operator notes"
  ],
  "disqualifiers": [],
  "suggested_angle": "Lead with evidence-backed lead briefs and review-gated drafts for solo consultant operators.",
  "recommended_next_action": "Review the lead brief, confirm the buyer/contact, then edit or approve the draft manually.",
  "approval_gate": "Operator review only. Agentic Hub does not send messages, submit forms, mutate CRM records, or use credentials in the MVP."
}
