{
  "schema_version": "1.0",
  "generated_at": "2026-06-11T22:30:00.000Z",
  "account_id": "acct_16",
  "account_name": "Account 16",
  "website": "https://account-16.example",
  "segment": "boutique_agency",
  "source": "demo fixture",
  "summary": "Creative operations agency with proposal pipeline in spreadsheets, inconsistent referral follow-up, and no weekly quality review.",
  "review_status": "needs_review",
  "review_note": "",
  "fit_score": 82,
  "score_breakdown": {
    "icp_match": 28,
    "pain_signal": 12,
    "ability_to_pay": 15,
    "reachable_context": 15,
    "timing_signal": 2,
    "strategic_relevance": 10
  },
  "fit_rationale": "This account appears aligned with the MVP because the target data points to relationship-heavy revenue work, scattered context, or follow-up discipline needs.",
  "confidence": "high",
  "evidence": [
    {
      "id": "ev_account_16_note_1",
      "source_type": "operator_note",
      "source_url": "inputs/targets.csv",
      "claim": "Creative operations agency with proposal pipeline in spreadsheets.",
      "confidence": "medium",
      "captured_at": "2026-06-11T22:30:00.000Z"
    },
    {
      "id": "ev_account_16_note_2",
      "source_type": "operator_note",
      "source_url": "inputs/targets.csv",
      "claim": "inconsistent referral follow-up.",
      "confidence": "medium",
      "captured_at": "2026-06-11T22:30:00.000Z"
    },
    {
      "id": "ev_account_16_website",
      "source_type": "website",
      "source_url": "https://account-16.example",
      "claim": "Website listed for account: https://account-16.example",
      "confidence": "medium",
      "captured_at": "2026-06-11T22:30:00.000Z"
    },
    {
      "id": "ev_account_16_segment",
      "source_type": "target_csv",
      "source_url": "inputs/targets.csv",
      "claim": "Segment from target list: boutique_agency",
      "confidence": "high",
      "captured_at": "2026-06-11T22:30:00.000Z"
    },
    {
      "id": "ev_account_16_source",
      "source_type": "target_csv",
      "source_url": "inputs/targets.csv",
      "claim": "Imported from source: demo fixture",
      "confidence": "high",
      "captured_at": "2026-06-11T22:30:00.000Z"
    }
  ],
  "contacts": [],
  "missing_information": [
    "Named buyer or decision-maker",
    "Recent public proof beyond operator notes"
  ],
  "disqualifiers": [],
  "suggested_angle": "Lead with evidence-backed lead briefs and review-gated drafts for boutique agency operators.",
  "recommended_next_action": "Review the lead brief, confirm the buyer/contact, then edit or approve the draft manually.",
  "approval_gate": "Operator review only. Agentic Hub does not send messages, submit forms, mutate CRM records, or use credentials in the MVP."
}
