{
  "schema_version": "1.0",
  "generated_at": "2026-06-11T22:30:00.000Z",
  "account_id": "acct_signalworks_strategy",
  "account_name": "SignalWorks Strategy",
  "website": "https://signalworks.example",
  "segment": "solo_consultant",
  "source": "demo fixture",
  "summary": "Independent strategy consultant with warm founder referrals, follow-up notes split across docs, wants a weekly pipeline review habit.",
  "review_status": "needs_review",
  "review_note": "",
  "fit_score": 80,
  "score_breakdown": {
    "icp_match": 30,
    "pain_signal": 8,
    "ability_to_pay": 15,
    "reachable_context": 15,
    "timing_signal": 2,
    "strategic_relevance": 10
  },
  "fit_rationale": "This account appears aligned with the MVP because the target data points to relationship-heavy revenue work, scattered context, or follow-up discipline needs.",
  "confidence": "high",
  "evidence": [
    {
      "id": "ev_acct_signalworks_strategy_research_8",
      "source_type": "manual_research",
      "source_url": "inputs/research.csv",
      "claim": "Operator research notes SignalWorks prefers warm founder referrals over broad outbound lists.",
      "confidence": "medium",
      "captured_at": "2026-06-11T22:30:00.000Z"
    },
    {
      "id": "ev_signalworks_strategy_note_1",
      "source_type": "operator_note",
      "source_url": "inputs/targets.csv",
      "claim": "Independent strategy consultant with warm founder referrals.",
      "confidence": "medium",
      "captured_at": "2026-06-11T22:30:00.000Z"
    },
    {
      "id": "ev_signalworks_strategy_note_2",
      "source_type": "operator_note",
      "source_url": "inputs/targets.csv",
      "claim": "follow-up notes split across docs.",
      "confidence": "medium",
      "captured_at": "2026-06-11T22:30:00.000Z"
    },
    {
      "id": "ev_signalworks_strategy_website",
      "source_type": "website",
      "source_url": "https://signalworks.example",
      "claim": "Website listed for account: https://signalworks.example",
      "confidence": "medium",
      "captured_at": "2026-06-11T22:30:00.000Z"
    },
    {
      "id": "ev_signalworks_strategy_segment",
      "source_type": "target_csv",
      "source_url": "inputs/targets.csv",
      "claim": "Segment from target list: solo_consultant",
      "confidence": "high",
      "captured_at": "2026-06-11T22:30:00.000Z"
    },
    {
      "id": "ev_signalworks_strategy_source",
      "source_type": "target_csv",
      "source_url": "inputs/targets.csv",
      "claim": "Imported from source: demo fixture",
      "confidence": "high",
      "captured_at": "2026-06-11T22:30:00.000Z"
    }
  ],
  "contacts": [
    {
      "id": "contact_acct_signalworks_strategy_nora_patel",
      "name": "Nora Patel",
      "role": "Principal",
      "context": "Operator-provided owner of warm founder referral workflow",
      "source": "fixture contacts",
      "confidence": "medium"
    }
  ],
  "missing_information": [],
  "disqualifiers": [],
  "suggested_angle": "Lead with evidence-backed lead briefs and review-gated drafts for solo consultant operators.",
  "recommended_next_action": "Review the lead brief, confirm the buyer/contact, then edit or approve the draft manually.",
  "approval_gate": "Operator review only. Agentic Hub does not send messages, submit forms, mutate CRM records, or use credentials in the MVP."
}
