{
  "schema_version": "1.0",
  "generated_at": "2026-06-11T22:40:00.000Z",
  "account_id": "acct_01",
  "account_name": "Account 01",
  "website": "https://account-01.example",
  "segment": "solo_consultant",
  "source": "demo fixture",
  "summary": "Founder sells RevOps retainers, tracks leads in spreadsheets, misses follow-ups after discovery calls, wants more evidence-backed personalization.",
  "review_status": "approved",
  "review_note": "Fixture operator approved as strongest ICP fit.",
  "fit_score": 86,
  "score_breakdown": {
    "icp_match": 30,
    "pain_signal": 12,
    "ability_to_pay": 15,
    "reachable_context": 15,
    "timing_signal": 4,
    "strategic_relevance": 10
  },
  "fit_rationale": "This account appears aligned with the MVP because the target data points to relationship-heavy revenue work, scattered context, or follow-up discipline needs.",
  "confidence": "high",
  "evidence": [
    {
      "id": "ev_acct_01_research_1",
      "source_type": "approved_public_source",
      "source_url": "https://account-01.example/services",
      "claim": "Public services page says Account 01 sells RevOps retainers for founder-led B2B teams.",
      "confidence": "high",
      "captured_at": "2026-06-11T22:30:00.000Z"
    },
    {
      "id": "ev_acct_01_research_2",
      "source_type": "manual_research",
      "source_url": "inputs/research.csv",
      "claim": "Operator confirmed Account 01 tracks lead follow-up in spreadsheets before client calls.",
      "confidence": "medium",
      "captured_at": "2026-06-11T22:30:00.000Z"
    },
    {
      "id": "ev_account_01_note_1",
      "source_type": "operator_note",
      "source_url": "inputs/targets.csv",
      "claim": "Founder sells RevOps retainers.",
      "confidence": "medium",
      "captured_at": "2026-06-11T22:30:00.000Z"
    },
    {
      "id": "ev_account_01_note_2",
      "source_type": "operator_note",
      "source_url": "inputs/targets.csv",
      "claim": "tracks leads in spreadsheets.",
      "confidence": "medium",
      "captured_at": "2026-06-11T22:30:00.000Z"
    },
    {
      "id": "ev_account_01_website",
      "source_type": "website",
      "source_url": "https://account-01.example",
      "claim": "Website listed for account: https://account-01.example",
      "confidence": "medium",
      "captured_at": "2026-06-11T22:30:00.000Z"
    },
    {
      "id": "ev_account_01_segment",
      "source_type": "target_csv",
      "source_url": "inputs/targets.csv",
      "claim": "Segment from target list: solo_consultant",
      "confidence": "high",
      "captured_at": "2026-06-11T22:30:00.000Z"
    },
    {
      "id": "ev_account_01_source",
      "source_type": "target_csv",
      "source_url": "inputs/targets.csv",
      "claim": "Imported from source: demo fixture",
      "confidence": "high",
      "captured_at": "2026-06-11T22:30:00.000Z"
    }
  ],
  "contacts": [
    {
      "id": "contact_01",
      "name": "Contact 01",
      "role": "Founder",
      "context": "Operator-provided tentative buyer because she owns RevOps retainer sales and follow-up process",
      "source": "fixture contacts",
      "confidence": "high"
    }
  ],
  "missing_information": [],
  "disqualifiers": [],
  "suggested_angle": "Lead with evidence-backed lead briefs and review-gated drafts for solo consultant operators.",
  "recommended_next_action": "Review the lead brief, confirm the buyer/contact, then edit or approve the draft manually.",
  "approval_gate": "Operator review only. Agentic Hub does not send messages, submit forms, mutate CRM records, or use credentials in the MVP."
}
