{
  "schema_version": "1.0",
  "generated_at": "2026-06-11T22:42:00.000Z",
  "account_id": "acct_quickscale_outreach",
  "account_name": "QuickScale Outreach",
  "website": "https://quickscale-outreach.example",
  "segment": "automation_vendor",
  "source": "demo fixture",
  "summary": "Vendor advertises autonomous high-volume outbound and asks for platform automation at scale.",
  "review_status": "rejected",
  "review_note": "Rejected because request conflicts with human-approved outbound boundary.",
  "fit_score": 28,
  "score_breakdown": {
    "icp_match": 5,
    "pain_signal": 0,
    "ability_to_pay": 6,
    "reachable_context": 15,
    "timing_signal": 0,
    "strategic_relevance": 2
  },
  "fit_rationale": "This account appears risky for the MVP because it conflicts with the supervised, human-approved workflow boundary.",
  "confidence": "low",
  "evidence": [
    {
      "id": "ev_quickscale_outreach_note_1",
      "source_type": "operator_note",
      "source_url": "inputs/targets.csv",
      "claim": "Vendor advertises autonomous high-volume outbound and asks for platform automation at scale.",
      "confidence": "medium",
      "captured_at": "2026-06-11T22:30:00.000Z"
    },
    {
      "id": "ev_quickscale_outreach_website",
      "source_type": "website",
      "source_url": "https://quickscale-outreach.example",
      "claim": "Website listed for account: https://quickscale-outreach.example",
      "confidence": "medium",
      "captured_at": "2026-06-11T22:30:00.000Z"
    },
    {
      "id": "ev_quickscale_outreach_segment",
      "source_type": "target_csv",
      "source_url": "inputs/targets.csv",
      "claim": "Segment from target list: automation_vendor",
      "confidence": "high",
      "captured_at": "2026-06-11T22:30:00.000Z"
    },
    {
      "id": "ev_quickscale_outreach_source",
      "source_type": "target_csv",
      "source_url": "inputs/targets.csv",
      "claim": "Imported from source: demo fixture",
      "confidence": "high",
      "captured_at": "2026-06-11T22:30:00.000Z"
    }
  ],
  "contacts": [],
  "missing_information": [
    "Named buyer or decision-maker",
    "Recent public proof beyond operator notes",
    "Follow-up trigger or current relationship context",
    "Legitimate supervised use case that does not require risky outbound automation"
  ],
  "disqualifiers": [
    "Requests autonomous or high-volume platform automation.",
    "Segment conflicts with the supervised, human-approved product boundary."
  ],
  "suggested_angle": "Do not position outreach automation. Clarify whether there is a supervised analytics or review workflow worth discussing.",
  "recommended_next_action": "Reject or clarify the use case before drafting any outreach.",
  "approval_gate": "Operator review only. Agentic Hub does not send messages, submit forms, mutate CRM records, or use credentials in the MVP."
}
