{
  "schema_version": "1.0",
  "generated_at": "2026-06-11T22:30:00.000Z",
  "account_id": "acct_cedar_grant_partners",
  "account_name": "Cedar Grant Partners",
  "website": "https://cedar-grants.example",
  "segment": "professional_services",
  "source": "demo fixture",
  "summary": "Grant writing consultancy with many warm relationships, deadline-driven follow-up windows, sensitive compliance language.",
  "review_status": "needs_review",
  "review_note": "",
  "fit_score": 71,
  "score_breakdown": {
    "icp_match": 24,
    "pain_signal": 8,
    "ability_to_pay": 12,
    "reachable_context": 15,
    "timing_signal": 4,
    "strategic_relevance": 8
  },
  "fit_rationale": "This account appears aligned with the MVP because the target data points to relationship-heavy revenue work, scattered context, or follow-up discipline needs.",
  "confidence": "high",
  "evidence": [
    {
      "id": "ev_acct_cedar_grant_partners_research_6",
      "source_type": "customer_provided",
      "source_url": "inputs/research.csv",
      "claim": "Client-provided context says compliance-safe recap language matters for grant deadline follow-ups.",
      "confidence": "high",
      "captured_at": "2026-06-11T22:30:00.000Z"
    },
    {
      "id": "ev_cedar_grant_partners_note_1",
      "source_type": "operator_note",
      "source_url": "inputs/targets.csv",
      "claim": "Grant writing consultancy with many warm relationships.",
      "confidence": "medium",
      "captured_at": "2026-06-11T22:30:00.000Z"
    },
    {
      "id": "ev_cedar_grant_partners_note_2",
      "source_type": "operator_note",
      "source_url": "inputs/targets.csv",
      "claim": "deadline-driven follow-up windows.",
      "confidence": "medium",
      "captured_at": "2026-06-11T22:30:00.000Z"
    },
    {
      "id": "ev_cedar_grant_partners_website",
      "source_type": "website",
      "source_url": "https://cedar-grants.example",
      "claim": "Website listed for account: https://cedar-grants.example",
      "confidence": "medium",
      "captured_at": "2026-06-11T22:30:00.000Z"
    },
    {
      "id": "ev_cedar_grant_partners_segment",
      "source_type": "target_csv",
      "source_url": "inputs/targets.csv",
      "claim": "Segment from target list: professional_services",
      "confidence": "high",
      "captured_at": "2026-06-11T22:30:00.000Z"
    },
    {
      "id": "ev_cedar_grant_partners_source",
      "source_type": "target_csv",
      "source_url": "inputs/targets.csv",
      "claim": "Imported from source: demo fixture",
      "confidence": "high",
      "captured_at": "2026-06-11T22:30:00.000Z"
    }
  ],
  "contacts": [
    {
      "id": "contact_acct_cedar_grant_partners_elena_brooks",
      "name": "Elena Brooks",
      "role": "Principal Consultant",
      "context": "Operator-provided relationship owner with compliance-sensitive follow-up needs",
      "source": "fixture contacts",
      "confidence": "medium"
    }
  ],
  "missing_information": [],
  "disqualifiers": [],
  "suggested_angle": "Lead with a human-reviewed follow-up queue for deadline-sensitive relationship workflows.",
  "recommended_next_action": "Review the lead brief, confirm the buyer/contact, then edit or approve the draft manually.",
  "approval_gate": "Operator review only. Agentic Hub does not send messages, submit forms, mutate CRM records, or use credentials in the MVP."
}
