{
  "schema_version": "1.0",
  "generated_at": "2026-06-11T22:30:00.000Z",
  "account_id": "acct_05",
  "account_name": "Account 05",
  "website": "https://account-05.example",
  "segment": "professional_services",
  "source": "demo fixture",
  "summary": "Managed IT advisory firm with high-ticket retainers, many referral leads, inconsistent renewal follow-ups, and no weekly pipeline analytics.",
  "review_status": "needs_review",
  "review_note": "",
  "fit_score": 79,
  "score_breakdown": {
    "icp_match": 24,
    "pain_signal": 16,
    "ability_to_pay": 12,
    "reachable_context": 15,
    "timing_signal": 4,
    "strategic_relevance": 8
  },
  "fit_rationale": "This account appears aligned with the MVP because the target data points to relationship-heavy revenue work, scattered context, or follow-up discipline needs.",
  "confidence": "high",
  "evidence": [
    {
      "id": "ev_acct_05_research_7",
      "source_type": "approved_public_source",
      "source_url": "https://account-05.example/services",
      "claim": "Public services page highlights managed IT renewals and referral-driven advisory work.",
      "confidence": "high",
      "captured_at": "2026-06-11T22:30:00.000Z"
    },
    {
      "id": "ev_account_05_note_1",
      "source_type": "operator_note",
      "source_url": "inputs/targets.csv",
      "claim": "Managed IT advisory firm with high-ticket retainers.",
      "confidence": "medium",
      "captured_at": "2026-06-11T22:30:00.000Z"
    },
    {
      "id": "ev_account_05_note_2",
      "source_type": "operator_note",
      "source_url": "inputs/targets.csv",
      "claim": "many referral leads.",
      "confidence": "medium",
      "captured_at": "2026-06-11T22:30:00.000Z"
    },
    {
      "id": "ev_account_05_website",
      "source_type": "website",
      "source_url": "https://account-05.example",
      "claim": "Website listed for account: https://account-05.example",
      "confidence": "medium",
      "captured_at": "2026-06-11T22:30:00.000Z"
    },
    {
      "id": "ev_account_05_segment",
      "source_type": "target_csv",
      "source_url": "inputs/targets.csv",
      "claim": "Segment from target list: professional_services",
      "confidence": "high",
      "captured_at": "2026-06-11T22:30:00.000Z"
    },
    {
      "id": "ev_account_05_source",
      "source_type": "target_csv",
      "source_url": "inputs/targets.csv",
      "claim": "Imported from source: demo fixture",
      "confidence": "high",
      "captured_at": "2026-06-11T22:30:00.000Z"
    }
  ],
  "contacts": [
    {
      "id": "contact_05",
      "name": "Contact 05",
      "role": "Managing Director",
      "context": "Operator-provided buyer for managed IT renewal and referral pipeline discipline",
      "source": "fixture contacts",
      "confidence": "medium"
    }
  ],
  "missing_information": [],
  "disqualifiers": [],
  "suggested_angle": "Lead with a local pipeline sprint for professional services teams that connects research quality, follow-up review, and weekly analytics.",
  "recommended_next_action": "Review the lead brief, confirm the buyer/contact, then edit or approve the draft manually.",
  "approval_gate": "Operator review only. Agentic Hub does not send messages, submit forms, mutate CRM records, or use credentials in the MVP."
}
